{
  "bid_id": "b_7fa",
  "agent_id": "ag_456",
  "context_id": "ctx_01H",
  "wallet_id": "w_456",
  "bid_vector": { "cpx": "0.03", "cpc": "0.50", "cpa": "12.00" },
  "preferred_unit": "CPA",
  "creative": {
    "title": "Pipedrive Starter",
    "body": "CRM for founders. 14 day trial",
    "cta": "Start trial",
    "deeplink": "https://example.com/trial"
  },
  "caps": { "session": 1, "daily": 5000, "geo_allow": ["US","CA"] },
  "ts": "2025-11-11T13:17:12Z",
  "auth": { "nonce": "n_8ab", "sig": "sig456" }
}
